{
  "schemaVersion": 1,
  "id": "engine.rpm",
  "revision": 1,
  "name": "Engine RPM",
  "unit": "rpm",
  "request": {
    "service": "01",
    "identifier": "0C",
    "route": "functional",
    "responseId": "7E8"
  },
  "response": {
    "prefix": "410C",
    "minPayloadBytes": 2
  },
  "decoder": {
    "byteOffset": 0,
    "byteLength": 2,
    "endian": "big",
    "signed": false,
    "numerator": 1,
    "denominator": 4,
    "offset": 0
  },
  "range": {
    "min": 0,
    "max": 16383.75
  },
  "pollIntervalMs": 500,
  "staleAfterMs": 2000,
  "provenance": {
    "source": "Standard OBD-II numeric example; sample is synthetic",
    "license": "Project-authored example",
    "vehicleScope": "Example CAN ECU 7E8 only; discover actual responder",
    "evidence": "synthetic"
  },
  "vectors": [
    {
      "payloadHex": "1AF8",
      "expected": 1726
    }
  ],
  "sourceId": "ecm"
}
