{
  "schemaVersion": 1,
  "id": "engine.coolant",
  "revision": 1,
  "name": "Coolant temperature",
  "unit": "degC",
  "request": {
    "service": "01",
    "identifier": "05",
    "route": "functional",
    "responseId": "7E8"
  },
  "response": {
    "prefix": "4105",
    "minPayloadBytes": 1
  },
  "decoder": {
    "byteOffset": 0,
    "byteLength": 1,
    "endian": "big",
    "signed": false,
    "numerator": 1,
    "denominator": 1,
    "offset": -40
  },
  "range": {
    "min": -40,
    "max": 215
  },
  "pollIntervalMs": 500,
  "staleAfterMs": 2000,
  "provenance": {
    "source": "Standard OBD-II numeric example; sample is synthetic",
    "license": "Project-authored example",
    "vehicleScope": "Example CAN ECU 7E8 only; discover actual responder",
    "evidence": "synthetic"
  },
  "vectors": [
    {
      "payloadHex": "7B",
      "expected": 83
    }
  ],
  "sourceId": "ecm"
}
